<?xml version="1.0" encoding="utf-8"?>
<?xml-stylesheet type="text/xsl" href="pdml2html.xsl"?>
<!-- You can find pdml2html.xsl in /usr/share/doc/wireshark or at https://gitlab.com/wireshark/wireshark/-/tree/master/resources/share/doc/wireshark/pdml2html.xsl. -->
<pdml version="0" creator="wireshark/4.4.7" time="Sun Jul 20 23:25:51 2025" capture_file="./pcaps/ethernet.pcap">
<packet>
  <proto name="geninfo" pos="0" showname="General information" size="158">
    <field name="num" pos="0" show="1" showname="Number" value="1" size="158"/>
    <field name="len" pos="0" show="158" showname="Frame Length" value="9e" size="158"/>
    <field name="caplen" pos="0" show="158" showname="Captured Length" value="9e" size="158"/>
    <field name="timestamp" pos="0" show="Dec  3, 2003 23:34:30.725473000 CST" showname="Captured Time" value="1070465670.725473000" size="158"/>
  </proto>
  <proto name="frame" showname="Frame 1: 158 bytes on wire (1264 bits), 158 bytes captured (1264 bits)" size="158" pos="0">
    <field name="frame.encap_type" showname="Encapsulation type: Ethernet (1)" size="0" pos="0" show="1"/>
    <field name="frame.time" showname="Arrival Time: Dec  3, 2003 23:34:30.725473000 CST" size="0" pos="0" show="Dec  3, 2003 23:34:30.725473000 CST"/>
    <field name="frame.time_utc" showname="UTC Arrival Time: Dec  3, 2003 15:34:30.725473000 UTC" size="0" pos="0" show="Dec  3, 2003 15:34:30.725473000 UTC"/>
    <field name="frame.time_epoch" showname="Epoch Arrival Time: 1070465670.725473000" size="0" pos="0" show="1070465670.725473000"/>
    <field name="frame.offset_shift" showname="Time shift for this packet: 0.000000000 seconds" size="0" pos="0" show="0.000000000"/>
    <field name="frame.time_delta" showname="Time delta from previous captured frame: 0.000000000 seconds" size="0" pos="0" show="0.000000000"/>
    <field name="frame.time_delta_displayed" showname="Time delta from previous displayed frame: 0.000000000 seconds" size="0" pos="0" show="0.000000000"/>
    <field name="frame.time_relative" showname="Time since reference or first frame: 0.000000000 seconds" size="0" pos="0" show="0.000000000"/>
    <field name="frame.number" showname="Frame Number: 1" size="0" pos="0" show="1"/>
    <field name="frame.len" showname="Frame Length: 158 bytes (1264 bits)" size="0" pos="0" show="158"/>
    <field name="frame.cap_len" showname="Capture Length: 158 bytes (1264 bits)" size="0" pos="0" show="158"/>
    <field name="frame.marked" showname="Frame is marked: False" size="0" pos="0" show="False"/>
    <field name="frame.ignored" showname="Frame is ignored: False" size="0" pos="0" show="False"/>
    <field name="frame.protocols" showname="Protocols in frame: eth:ethertype:ip:tcp:enip:cip:cipcm" size="0" pos="0" show="eth:ethertype:ip:tcp:enip:cip:cipcm"/>
  </proto>
  <proto name="eth" showname="Ethernet II, Src: RockwellAuto_05:68:b8 (00:00:bc:05:68:b8), Dst: RockwellAuto_08:67:3e (00:00:bc:08:67:3e)" size="14" pos="0">
    <field name="eth.dst" showname="Destination: RockwellAuto_08:67:3e (00:00:bc:08:67:3e)" size="6" pos="0" show="00:00:bc:08:67:3e" value="0000bc08673e">
      <field name="eth.dst_resolved" showname="Destination (resolved): RockwellAuto_08:67:3e" hide="yes" size="6" pos="0" show="RockwellAuto_08:67:3e" value="0000bc08673e"/>
      <field name="eth.dst.oui" showname="Destination OUI: 00:00:bc (Rockwell Automation)" hide="yes" size="3" pos="0" show="188" value="0000bc"/>
      <field name="eth.dst.oui_resolved" showname="Destination OUI (resolved): Rockwell Automation" hide="yes" size="6" pos="0" show="Rockwell Automation" value="0000bc08673e"/>
      <field name="eth.dst.lg" showname=".... ..0. .... .... .... .... = LG bit: Globally unique address (factory default)" size="3" pos="0" show="False" value="0" unmaskedvalue="0000bc"/>
      <field name="eth.dst.ig" showname=".... ...0 .... .... .... .... = IG bit: Individual address (unicast)" size="3" pos="0" show="False" value="0" unmaskedvalue="0000bc"/>
      <field name="eth.addr" showname="Address: RockwellAuto_08:67:3e (00:00:bc:08:67:3e)" hide="yes" size="6" pos="0" show="00:00:bc:08:67:3e" value="0000bc08673e"/>
      <field name="eth.addr_resolved" showname="Address (resolved): RockwellAuto_08:67:3e" hide="yes" size="6" pos="0" show="RockwellAuto_08:67:3e" value="0000bc08673e"/>
      <field name="eth.addr.oui" showname="Address OUI: 00:00:bc (Rockwell Automation)" hide="yes" size="3" pos="0" show="188" value="0000bc"/>
      <field name="eth.addr.oui_resolved" showname="Address OUI (resolved): Rockwell Automation" hide="yes" size="6" pos="0" show="Rockwell Automation" value="0000bc08673e"/>
      <field name="eth.lg" showname=".... ..0. .... .... .... .... = LG bit: Globally unique address (factory default)" hide="yes" size="3" pos="0" show="False" value="0" unmaskedvalue="0000bc"/>
      <field name="eth.ig" showname=".... ...0 .... .... .... .... = IG bit: Individual address (unicast)" hide="yes" size="3" pos="0" show="False" value="0" unmaskedvalue="0000bc"/>
    </field>
    <field name="eth.src" showname="Source: RockwellAuto_05:68:b8 (00:00:bc:05:68:b8)" size="6" pos="6" show="00:00:bc:05:68:b8" value="0000bc0568b8">
      <field name="eth.src_resolved" showname="Source (resolved): RockwellAuto_05:68:b8" hide="yes" size="6" pos="6" show="RockwellAuto_05:68:b8" value="0000bc0568b8"/>
      <field name="eth.src.oui" showname="Source OUI: 00:00:bc (Rockwell Automation)" hide="yes" size="3" pos="6" show="188" value="0000bc"/>
      <field name="eth.src.oui_resolved" showname="Source OUI (resolved): Rockwell Automation" hide="yes" size="6" pos="6" show="Rockwell Automation" value="0000bc0568b8"/>
      <field name="eth.src.lg" showname=".... ..0. .... .... .... .... = LG bit: Globally unique address (factory default)" size="3" pos="6" show="False" value="0" unmaskedvalue="0000bc"/>
      <field name="eth.src.ig" showname=".... ...0 .... .... .... .... = IG bit: Individual address (unicast)" size="3" pos="6" show="False" value="0" unmaskedvalue="0000bc"/>
      <field name="eth.addr" showname="Address: RockwellAuto_05:68:b8 (00:00:bc:05:68:b8)" hide="yes" size="6" pos="6" show="00:00:bc:05:68:b8" value="0000bc0568b8"/>
      <field name="eth.addr_resolved" showname="Address (resolved): RockwellAuto_05:68:b8" hide="yes" size="6" pos="6" show="RockwellAuto_05:68:b8" value="0000bc0568b8"/>
      <field name="eth.addr.oui" showname="Address OUI: 00:00:bc (Rockwell Automation)" hide="yes" size="3" pos="6" show="188" value="0000bc"/>
      <field name="eth.addr.oui_resolved" showname="Address OUI (resolved): Rockwell Automation" hide="yes" size="6" pos="6" show="Rockwell Automation" value="0000bc0568b8"/>
      <field name="eth.lg" showname=".... ..0. .... .... .... .... = LG bit: Globally unique address (factory default)" hide="yes" size="3" pos="6" show="False" value="0" unmaskedvalue="0000bc"/>
      <field name="eth.ig" showname=".... ...0 .... .... .... .... = IG bit: Individual address (unicast)" hide="yes" size="3" pos="6" show="False" value="0" unmaskedvalue="0000bc"/>
    </field>
    <field name="eth.type" showname="Type: IPv4 (0x0800)" size="2" pos="12" show="0x0800" value="0800"/>
    <field name="eth.stream" showname="Stream index: 0" size="0" pos="0" show="0"/>
    <field name="eth.fcs" showname="Frame check sequence: 0xc0dbe4e4 [unverified]" size="4" pos="154" show="0xc0dbe4e4" value="c0dbe4e4"/>
    <field name="eth.fcs.status" showname="FCS Status: Unverified" size="0" pos="154" show="2"/>
  </proto>
  <proto name="ip" showname="Internet Protocol Version 4, Src: 192.168.100.28, Dst: 192.168.100.36" size="20" pos="14">
    <field name="ip.version" showname="0100 .... = Version: 4" size="1" pos="14" show="4" value="45"/>
    <field name="ip.hdr_len" showname=".... 0101 = Header Length: 20 bytes (5)" size="1" pos="14" show="20" value="45"/>
    <field name="ip.dsfield" showname="Differentiated Services Field: 0x00 (DSCP: CS0, ECN: Not-ECT)" size="1" pos="15" show="0x00" value="00">
      <field name="ip.dsfield.dscp" showname="0000 00.. = Differentiated Services Codepoint: Default (0)" size="1" pos="15" show="0" value="0" unmaskedvalue="00"/>
      <field name="ip.dsfield.ecn" showname=".... ..00 = Explicit Congestion Notification: Not ECN-Capable Transport (0)" size="1" pos="15" show="0" value="0" unmaskedvalue="00"/>
    </field>
    <field name="ip.len" showname="Total Length: 140" size="2" pos="16" show="140" value="008c"/>
    <field name="ip.id" showname="Identification: 0x4ccf (19663)" size="2" pos="18" show="0x4ccf" value="4ccf"/>
    <field name="ip.flags" showname="000. .... = Flags: 0x0" size="1" pos="20" show="0x00" value="0" unmaskedvalue="00">
      <field name="ip.flags.rb" showname="0... .... = Reserved bit: Not set" size="1" pos="20" show="False" value="0" unmaskedvalue="00"/>
      <field name="ip.flags.df" showname=".0.. .... = Don&#x27;t fragment: Not set" size="1" pos="20" show="False" value="0" unmaskedvalue="00"/>
      <field name="ip.flags.mf" showname="..0. .... = More fragments: Not set" size="1" pos="20" show="False" value="0" unmaskedvalue="00"/>
    </field>
    <field name="ip.frag_offset" showname="...0 0000 0000 0000 = Fragment Offset: 0" size="2" pos="20" show="0" value="0" unmaskedvalue="0000"/>
    <field name="ip.ttl" showname="Time to Live: 64" size="1" pos="22" show="64" value="40"/>
    <field name="ip.proto" showname="Protocol: TCP (6)" size="1" pos="23" show="6" value="06"/>
    <field name="ip.checksum" showname="Header Checksum: 0xe40b [validation disabled]" size="2" pos="24" show="0xe40b" value="e40b"/>
    <field name="ip.checksum.status" showname="Header checksum status: Unverified" size="0" pos="24" show="2"/>
    <field name="ip.src" showname="Source Address: 192.168.100.28" size="4" pos="26" show="192.168.100.28" value="c0a8641c"/>
    <field name="ip.addr" showname="Source or Destination Address: 192.168.100.28" hide="yes" size="4" pos="26" show="192.168.100.28" value="c0a8641c"/>
    <field name="ip.src_host" showname="Source Host: 192.168.100.28" hide="yes" size="4" pos="26" show="192.168.100.28" value="c0a8641c"/>
    <field name="ip.host" showname="Source or Destination Host: 192.168.100.28" hide="yes" size="4" pos="26" show="192.168.100.28" value="c0a8641c"/>
    <field name="ip.dst" showname="Destination Address: 192.168.100.36" size="4" pos="30" show="192.168.100.36" value="c0a86424"/>
    <field name="ip.addr" showname="Source or Destination Address: 192.168.100.36" hide="yes" size="4" pos="30" show="192.168.100.36" value="c0a86424"/>
    <field name="ip.dst_host" showname="Destination Host: 192.168.100.36" hide="yes" size="4" pos="30" show="192.168.100.36" value="c0a86424"/>
    <field name="ip.host" showname="Source or Destination Host: 192.168.100.36" hide="yes" size="4" pos="30" show="192.168.100.36" value="c0a86424"/>
    <field name="ip.stream" showname="Stream index: 0" size="0" pos="34" show="0"/>
  </proto>
  <proto name="tcp" showname="Transmission Control Protocol, Src Port: 4495, Dst Port: 44818, Seq: 1, Ack: 1, Len: 100" size="20" pos="34">
    <field name="tcp.srcport" showname="Source Port: 4495" size="2" pos="34" show="4495" value="118f"/>
    <field name="tcp.dstport" showname="Destination Port: 44818" size="2" pos="36" show="44818" value="af12"/>
    <field name="tcp.port" showname="Source or Destination Port: 4495" hide="yes" size="2" pos="34" show="4495" value="118f"/>
    <field name="tcp.port" showname="Source or Destination Port: 44818" hide="yes" size="2" pos="36" show="44818" value="af12"/>
    <field name="tcp.stream" showname="Stream index: 0" size="0" pos="34" show="0"/>
    <field name="tcp.stream.pnum" showname="Stream Packet Number: 1" size="0" pos="34" show="1"/>
    <field name="tcp.completeness" showname="Conversation completeness: Incomplete (0)" size="0" pos="34" show="0">
      <field name="tcp.completeness.rst" showname="..0. .... = RST: Absent" size="0" pos="0" show="False"/>
      <field name="tcp.completeness.fin" showname="...0 .... = FIN: Absent" size="0" pos="0" show="False"/>
      <field name="tcp.completeness.data" showname=".... 0... = Data: Absent" size="0" pos="0" show="False"/>
      <field name="tcp.completeness.ack" showname=".... .0.. = ACK: Absent" size="0" pos="0" show="False"/>
      <field name="tcp.completeness.syn-ack" showname=".... ..0. = SYN-ACK: Absent" size="0" pos="0" show="False"/>
      <field name="tcp.completeness.syn" showname=".... ...0 = SYN: Absent" size="0" pos="0" show="False"/>
      <field name="tcp.completeness.str" showname="Completeness Flags: [ Null ]" size="0" pos="34" show="[ Null ]"/>
    </field>
    <field name="tcp.len" showname="TCP Segment Len: 100" size="0" pos="34" show="100"/>
    <field name="tcp.seq" showname="Sequence Number: 1    (relative sequence number)" size="4" pos="38" show="1" value="4da2dd48"/>
    <field name="tcp.seq_raw" showname="Sequence Number (raw): 1302519112" size="4" pos="38" show="1302519112" value="4da2dd48"/>
    <field name="tcp.nxtseq" showname="Next Sequence Number: 101    (relative sequence number)" size="0" pos="34" show="101"/>
    <field name="tcp.ack" showname="Acknowledgment Number: 1    (relative ack number)" size="4" pos="42" show="1" value="512b989f"/>
    <field name="tcp.ack_raw" showname="Acknowledgment number (raw): 1361811615" size="4" pos="42" show="1361811615" value="512b989f"/>
    <field name="tcp.hdr_len" showname="0101 .... = Header Length: 20 bytes (5)" size="1" pos="46" show="20" value="50"/>
    <field name="tcp.flags" showname="Flags: 0x018 (PSH, ACK)" size="2" pos="46" show="0x0018" value="18" unmaskedvalue="5018">
      <field name="tcp.flags.res" showname="000. .... .... = Reserved: Not set" size="1" pos="46" show="False" value="0" unmaskedvalue="50"/>
      <field name="tcp.flags.ae" showname="...0 .... .... = Accurate ECN: Not set" size="1" pos="46" show="False" value="0" unmaskedvalue="50"/>
      <field name="tcp.flags.cwr" showname=".... 0... .... = Congestion Window Reduced: Not set" size="1" pos="47" show="False" value="0" unmaskedvalue="18"/>
      <field name="tcp.flags.ece" showname=".... .0.. .... = ECN-Echo: Not set" size="1" pos="47" show="False" value="0" unmaskedvalue="18"/>
      <field name="tcp.flags.urg" showname=".... ..0. .... = Urgent: Not set" size="1" pos="47" show="False" value="0" unmaskedvalue="18"/>
      <field name="tcp.flags.ack" showname=".... ...1 .... = Acknowledgment: Set" size="1" pos="47" show="True" value="1" unmaskedvalue="18"/>
      <field name="tcp.flags.push" showname=".... .... 1... = Push: Set" size="1" pos="47" show="True" value="1" unmaskedvalue="18"/>
      <field name="tcp.flags.reset" showname=".... .... .0.. = Reset: Not set" size="1" pos="47" show="False" value="0" unmaskedvalue="18"/>
      <field name="tcp.flags.syn" showname=".... .... ..0. = Syn: Not set" size="1" pos="47" show="False" value="0" unmaskedvalue="18"/>
      <field name="tcp.flags.fin" showname=".... .... ...0 = Fin: Not set" size="1" pos="47" show="False" value="0" unmaskedvalue="18"/>
      <field name="tcp.flags.str" showname="TCP Flags: ·······AP···" size="2" pos="46" show="·······AP···" value="5018"/>
    </field>
    <field name="tcp.window_size_value" showname="Window: 16384" size="2" pos="48" show="16384" value="4000"/>
    <field name="tcp.window_size" showname="Calculated window size: 16384" size="2" pos="48" show="16384" value="4000"/>
    <field name="tcp.window_size_scalefactor" showname="Window size scaling factor: -1 (unknown)" size="2" pos="48" show="-1" value="4000"/>
    <field name="tcp.checksum" showname="Checksum: 0x34c7 [unverified]" size="2" pos="50" show="0x34c7" value="34c7"/>
    <field name="tcp.checksum.status" showname="Checksum Status: Unverified" size="0" pos="50" show="2"/>
    <field name="tcp.urgent_pointer" showname="Urgent Pointer: 0" size="2" pos="52" show="0" value="0000"/>
    <field name="" show="Timestamps" size="0" pos="34">
      <field name="tcp.time_relative" showname="Time since first frame in this TCP stream: 0.000000000 seconds" size="0" pos="34" show="0.000000000"/>
      <field name="tcp.time_delta" showname="Time since previous frame in this TCP stream: 0.000000000 seconds" size="0" pos="34" show="0.000000000"/>
    </field>
    <field name="tcp.analysis" showname="SEQ/ACK analysis" size="0" pos="34" show="" value="">
      <field name="tcp.analysis.bytes_in_flight" showname="Bytes in flight: 100" size="0" pos="34" show="100"/>
      <field name="tcp.analysis.push_bytes_sent" showname="Bytes sent since last PSH flag: 100" size="0" pos="34" show="100"/>
    </field>
    <field name="tcp.payload" showname="TCP payload (100 bytes)" size="100" pos="54" show="6f:00:4c:00:01:00:00:00:00:00:00:00:c0:a8:64:1c:00:00:40:7e:00:00:00:00:00:00:00:00:00:00:02:00:00:00:00:00:b2:00:3c:00:54:02:20:06:24:01:05:9b:00:00:00:00:00:00:00:00:0e:00:01:00:22:f5:13:00:02:00:00:00:10:27:00:00:1a:48:10:27:00:00:1a:28:01:09:34:04:00:00:00:00:00:00:00:00:20:04:24:06:2c:02:2c:01" value="6f004c000100000000000000c0a8641c0000407e00000000000000000000020000000000b2003c00540220062401059b00000000000000000e00010022f5130002000000102700001a48102700001a28010934040000000000000000200424062c022c01"/>
    <field name="tcp.pdu.size" showname="PDU Size: 100" size="100" pos="54" show="100" value="6f004c000100000000000000c0a8641c0000407e00000000000000000000020000000000b2003c00540220062401059b00000000000000000e00010022f5130002000000102700001a48102700001a28010934040000000000000000200424062c022c01"/>
  </proto>
  <proto name="enip" showname="EtherNet/IP (Industrial Protocol), Session: 0x00000001, Send RR Data" size="100" pos="54">
    <field name="" show="Encapsulation Header" size="24" pos="54" value="6f004c000100000000000000c0a8641c0000407e00000000">
      <field name="enip.command" showname="Command: Send RR Data (0x006f)" size="2" pos="54" show="0x006f" value="6f00"/>
      <field name="enip.length" showname="Length: 76" size="2" pos="56" show="76" value="4c00"/>
      <field name="enip.session" showname="Session Handle: 0x00000001" size="4" pos="58" show="0x00000001" value="01000000"/>
      <field name="enip.status" showname="Status: Success (0x00000000)" size="4" pos="62" show="0x00000000" value="00000000"/>
      <field name="enip.context" showname="Sender Context: c0a8641c0000407e" size="8" pos="66" show="c0:a8:64:1c:00:00:40:7e" value="c0a8641c0000407e"/>
      <field name="enip.options" showname="Options: 0x00000000" size="4" pos="74" show="0x00000000" value="00000000"/>
    </field>
    <field name="" show="Command Specific Data" size="76" pos="78" value="000000000000020000000000b2003c00540220062401059b00000000000000000e00010022f5130002000000102700001a48102700001a28010934040000000000000000200424062c022c01">
      <field name="enip.srrd.iface" showname="Interface Handle: CIP (0x00000000)" size="4" pos="78" show="0x00000000" value="00000000"/>
      <field name="enip.timeout" showname="Timeout: 0" size="2" pos="82" show="0" value="0000"/>
      <field name="enip.cpf.itemcount" showname="Item Count: 2" size="2" pos="84" show="2" value="0200">
        <field name="enip.cpf.typeid" showname="Type ID: Null Address Item (0x0000)" size="2" pos="86" show="0x0000" value="0000">
          <field name="enip.cpf.length" showname="Length: 0" size="2" pos="88" show="0" value="0000"/>
        </field>
        <field name="enip.cpf.typeid" showname="Type ID: Unconnected Data Item (0x00b2)" size="2" pos="90" show="0x00b2" value="b200">
          <field name="enip.cpf.length" showname="Length: 60" size="2" pos="92" show="60" value="3c00"/>
        </field>
      </field>
      <field name="_ws.expert" showname="Expert Info (Note/Protocol): CIP request without a response" size="0" pos="78">
        <field name="cip.analysis.request_no_response" showname="CIP request without a response" size="0" pos="0" show="" value=""/>
        <field name="_ws.expert.message" showname="Message: CIP request without a response" hide="yes" size="0" pos="0" show="CIP request without a response"/>
        <field name="_ws.expert.severity" showname="Severity level: Note" size="0" pos="0" show="4194304"/>
        <field name="_ws.expert.group" showname="Group: Protocol" size="0" pos="0" show="150994944"/>
      </field>
    </field>
  </proto>
  <proto name="cip" showname="Common Industrial Protocol" size="60" pos="94">
    <field name="cip.service" showname="Service: Unknown Service (0x54) (Request)" size="1" pos="94" show="0x54" value="54">
      <field name="cip.rr" showname="0... .... = Request/Response: Request (0x0)" size="1" pos="94" show="0x00" value="0" unmaskedvalue="54"/>
      <field name="cip.sc" showname=".101 0100 = Service: Unknown (0x54)" size="1" pos="94" show="0x54" value="54" unmaskedvalue="54"/>
    </field>
    <field name="cip.request_path_size" showname="Request Path Size: 2 words" size="1" pos="95" show="2" value="02"/>
    <field name="" show="Request Path: Connection Manager, Instance: 0x01" size="4" pos="96" value="20062401">
      <field name="cip.epath" showname="EPath: 20062401" hide="yes" size="4" pos="96" show="20:06:24:01" value="20062401"/>
      <field name="cip.path_segment" showname="Path Segment: 0x20 (8-Bit Class Segment)" size="2" pos="96" show="0x20" value="2006">
        <field name="cip.path_segment.type" showname="001. .... = Path Segment Type: Logical Segment (1)" size="1" pos="96" show="1" value="1" unmaskedvalue="20"/>
        <field name="cip.logical_segment.type" showname="...0 00.. = Logical Segment Type: Class ID (0)" size="1" pos="96" show="0" value="0" unmaskedvalue="20"/>
        <field name="cip.logical_segment.format" showname=".... ..00 = Logical Segment Format: 8-bit Logical Segment (0)" size="1" pos="96" show="0" value="0" unmaskedvalue="20"/>
        <field name="cip.class" showname="Class: Connection Manager (0x06)" size="1" pos="97" show="0x06" value="06"/>
      </field>
      <field name="cip.path_segment" showname="Path Segment: 0x24 (8-Bit Instance Segment)" size="2" pos="98" show="0x24" value="2401">
        <field name="cip.path_segment.type" showname="001. .... = Path Segment Type: Logical Segment (1)" size="1" pos="98" show="1" value="1" unmaskedvalue="24"/>
        <field name="cip.logical_segment.type" showname="...0 01.. = Logical Segment Type: Instance ID (1)" size="1" pos="98" show="1" value="1" unmaskedvalue="24"/>
        <field name="cip.logical_segment.format" showname=".... ..00 = Logical Segment Format: 8-bit Logical Segment (0)" size="1" pos="98" show="0" value="0" unmaskedvalue="24"/>
        <field name="cip.instance" showname="Instance: 0x01" size="1" pos="99" show="0x01" value="01"/>
      </field>
    </field>
  </proto>
  <proto name="cipcm" showname="CIP Connection Manager" size="60" pos="94">
    <field name="" show="Service: Forward Open (Request)" size="1" pos="94" value="54">
      <field name="cip.rr" showname="0... .... = Request/Response: Request (0x0)" size="1" pos="94" show="0x00" value="0" unmaskedvalue="54"/>
      <field name="cip.cm.sc" showname=".101 0100 = Service: Forward Open (0x54)" size="1" pos="94" show="0x54" value="54" unmaskedvalue="54"/>
    </field>
    <field name="" show="Command Specific Data" size="54" pos="100" value="059b00000000000000000e00010022f5130002000000102700001a48102700001a28010934040000000000000000200424062c022c01">
      <field name="cip.cm.priority" showname="...0 .... = Priority: 0" size="1" pos="100" show="0" value="0" unmaskedvalue="05"/>
      <field name="cip.cm.tick_time" showname=".... 0101 = Tick time: 5" size="1" pos="100" show="5" value="5" unmaskedvalue="05"/>
      <field name="cip.cm.timeout_tick" showname="Time-out ticks: 155" size="1" pos="101" show="155" value="9b"/>
      <field name="cip.cm.timeout" showname="Actual Time Out: 4960ms" size="2" pos="100" show="4960" value="059b"/>
      <field name="cip.cm.ot_connid" showname="O-&gt;T Network Connection ID: 0x00000000" size="4" pos="102" show="0x00000000" value="00000000"/>
      <field name="cip.cm.to_connid" showname="T-&gt;O Network Connection ID: 0x00000000" size="4" pos="106" show="0x00000000" value="00000000"/>
      <field name="cip.connid" showname="Connection ID: 0x00000000" hide="yes" size="4" pos="102" show="0x00000000" value="00000000"/>
      <field name="cip.connid" showname="Connection ID: 0x00000000" hide="yes" size="4" pos="106" show="0x00000000" value="00000000"/>
      <field name="cip.cm.conn_serial_num" showname="Connection Serial Number: 0x000e" size="2" pos="110" show="0x000e" value="0e00"/>
      <field name="cip.cm.vendor" showname="Originator Vendor ID: Rockwell Automation/Allen-Bradley (0x0001)" size="2" pos="112" show="0x0001" value="0100"/>
      <field name="cip.cm.orig_serial_num" showname="Originator Serial Number: 0x0013f522" size="4" pos="114" show="0x0013f522" value="22f51300"/>
      <field name="cip.cm.timeout_multiplier" showname="Connection Timeout Multiplier: *16 (2)" size="1" pos="118" show="2" value="02"/>
      <field name="cip.reserved" showname="Reserved: 0x000000" size="3" pos="119" show="0x000000" value="000000"/>
      <field name="cip.cm.otrpi" showname="O-&gt;T RPI: 10.000ms" size="4" pos="122" show="10000" value="10270000"/>
      <field name="cip.cm.ot_net_params" showname="O-&gt;T Network Connection Parameters: 0x481a" size="2" pos="126" show="0x481a" value="1a48">
        <field name="cip.cm.fwo.owner" showname="0... .... .... .... = Redundant Owner: Non-Redundant (0)" size="2" pos="126" show="0" value="0" unmaskedvalue="1a48"/>
        <field name="cip.cm.fwo.type" showname=".10. .... .... .... = Connection Type: Point to Point (2)" size="2" pos="126" show="2" value="2" unmaskedvalue="1a48"/>
        <field name="cip.cm.fwo.prio" showname=".... 10.. .... .... = Priority: Scheduled (2)" size="2" pos="126" show="2" value="2" unmaskedvalue="1a48"/>
        <field name="cip.cm.fwo.f_v" showname=".... ..0. .... .... = Connection Size Type: Fixed (0)" size="2" pos="126" show="0" value="0" unmaskedvalue="1a48"/>
        <field name="cip.cm.fwo.consize" showname=".... ...0 0001 1010 = Connection Size: 26 bytes" size="2" pos="126" show="26" value="1A" unmaskedvalue="1a48"/>
      </field>
      <field name="cip.cm.torpi" showname="T-&gt;O RPI: 10.000ms" size="4" pos="128" show="10000" value="10270000"/>
      <field name="cip.cm.to_net_params" showname="T-&gt;O Network Connection Parameters: 0x281a" size="2" pos="132" show="0x281a" value="1a28">
        <field name="cip.cm.fwo.owner" showname="0... .... .... .... = Redundant Owner: Non-Redundant (0)" size="2" pos="132" show="0" value="0" unmaskedvalue="1a28"/>
        <field name="cip.cm.fwo.type" showname=".01. .... .... .... = Connection Type: Multicast (1)" size="2" pos="132" show="1" value="1" unmaskedvalue="1a28"/>
        <field name="cip.cm.fwo.prio" showname=".... 10.. .... .... = Priority: Scheduled (2)" size="2" pos="132" show="2" value="2" unmaskedvalue="1a28"/>
        <field name="cip.cm.fwo.f_v" showname=".... ..0. .... .... = Connection Size Type: Fixed (0)" size="2" pos="132" show="0" value="0" unmaskedvalue="1a28"/>
        <field name="cip.cm.fwo.consize" showname=".... ...0 0001 1010 = Connection Size: 26 bytes" size="2" pos="132" show="26" value="1A" unmaskedvalue="1a28"/>
      </field>
      <field name="cip.cm.transport_type_trigger" showname="Transport Type/Trigger: 0x01, Trigger: Cyclic, Class: 1" size="1" pos="134" show="0x01" value="01">
        <field name="cip.cm.fwo.dir" showname="0... .... = Direction: Client" size="1" pos="134" show="False" value="0" unmaskedvalue="01"/>
        <field name="cip.cm.fwo.trigger" showname=".000 .... = Trigger: Cyclic (0)" size="1" pos="134" show="0" value="0" unmaskedvalue="01"/>
        <field name="cip.cm.fwo.transport" showname=".... 0001 = Class: 1 (1)" size="1" pos="134" show="1" value="1" unmaskedvalue="01"/>
      </field>
      <field name="cip.cm.connpath_size" showname="Connection Path Size: 9 words" size="1" pos="135" show="9" value="09"/>
      <field name="" show="Connection Path: [Key], Assembly, Instance: 0x06, Connection Point: 0x02, Connection Point: 0x01" size="18" pos="136" value="34040000000000000000200424062c022c01">
        <field name="cip.epath" showname="EPath: 34040000000000000000200424062c022c01" hide="yes" size="18" pos="136" show="34:04:00:00:00:00:00:00:00:00:20:04:24:06:2c:02:2c:01" value="34040000000000000000200424062c022c01"/>
        <field name="cip.path_segment" showname="Path Segment: 0x34 (Electronic Key Segment) (VendorID: 0x0000, DevTyp: 0x0000, 0.0)" size="10" pos="136" show="0x34" value="34040000000000000000">
          <field name="cip.path_segment.type" showname="001. .... = Path Segment Type: Logical Segment (1)" size="1" pos="136" show="1" value="1" unmaskedvalue="34"/>
          <field name="cip.logical_segment.type" showname="...1 01.. = Logical Segment Type: Special (5)" size="1" pos="136" show="5" value="5" unmaskedvalue="34"/>
          <field name="cip.ekey.format" showname="Key Format: 0x04" size="1" pos="137" show="0x04" value="04"/>
          <field name="cip.ekey.vendor" showname="Vendor ID: Unknown (0x0000)" size="2" pos="138" show="0x0000" value="0000"/>
          <field name="cip.ekey.devtype" showname="Device Type: Generic Device (deprecated) (0x0000)" size="2" pos="140" show="0x0000" value="0000"/>
          <field name="cip.ekey.product_code" showname="Product Code: 0x0000" size="2" pos="142" show="0x0000" value="0000"/>
          <field name="cip.ekey.compatibility" showname="Compatibility: Bit Cleared, Major Revision: 0" size="1" pos="144" show="0x00" value="00">
            <field name="cip.ekey.comp_bit" showname="0... .... = Compatibility: Bit Cleared (0x0)" size="1" pos="144" show="0x00" value="0" unmaskedvalue="00"/>
            <field name="cip.ekey.major_rev" showname=".000 0000 = Major Revision: 0" size="1" pos="144" show="0" value="0" unmaskedvalue="00"/>
          </field>
          <field name="cip.ekey.minor_rev" showname="Minor Revision: 0" size="1" pos="145" show="0" value="00"/>
        </field>
        <field name="cip.path_segment" showname="Path Segment: 0x20 (8-Bit Class Segment)" size="2" pos="146" show="0x20" value="2004">
          <field name="cip.path_segment.type" showname="001. .... = Path Segment Type: Logical Segment (1)" size="1" pos="146" show="1" value="1" unmaskedvalue="20"/>
          <field name="cip.logical_segment.type" showname="...0 00.. = Logical Segment Type: Class ID (0)" size="1" pos="146" show="0" value="0" unmaskedvalue="20"/>
          <field name="cip.logical_segment.format" showname=".... ..00 = Logical Segment Format: 8-bit Logical Segment (0)" size="1" pos="146" show="0" value="0" unmaskedvalue="20"/>
          <field name="cip.class" showname="Class: Assembly (0x04)" size="1" pos="147" show="0x04" value="04"/>
        </field>
        <field name="cip.path_segment" showname="Path Segment: 0x24 (8-Bit Instance Segment)" size="2" pos="148" show="0x24" value="2406">
          <field name="cip.path_segment.type" showname="001. .... = Path Segment Type: Logical Segment (1)" size="1" pos="148" show="1" value="1" unmaskedvalue="24"/>
          <field name="cip.logical_segment.type" showname="...0 01.. = Logical Segment Type: Instance ID (1)" size="1" pos="148" show="1" value="1" unmaskedvalue="24"/>
          <field name="cip.logical_segment.format" showname=".... ..00 = Logical Segment Format: 8-bit Logical Segment (0)" size="1" pos="148" show="0" value="0" unmaskedvalue="24"/>
          <field name="cip.instance" showname="Instance: 0x06" size="1" pos="149" show="0x06" value="06"/>
        </field>
        <field name="cip.path_segment" showname="Path Segment: 0x2c (8-Bit Connection Point Segment)" size="2" pos="150" show="0x2c" value="2c02">
          <field name="cip.path_segment.type" showname="001. .... = Path Segment Type: Logical Segment (1)" size="1" pos="150" show="1" value="1" unmaskedvalue="2c"/>
          <field name="cip.logical_segment.type" showname="...0 11.. = Logical Segment Type: Connection Point (3)" size="1" pos="150" show="3" value="3" unmaskedvalue="2c"/>
          <field name="cip.logical_segment.format" showname=".... ..00 = Logical Segment Format: 8-bit Logical Segment (0)" size="1" pos="150" show="0" value="0" unmaskedvalue="2c"/>
          <field name="cip.connpoint" showname="Connection Point: 0x02" size="1" pos="151" show="0x02" value="02"/>
        </field>
        <field name="cip.path_segment" showname="Path Segment: 0x2c (8-Bit Connection Point Segment)" size="2" pos="152" show="0x2c" value="2c01">
          <field name="cip.path_segment.type" showname="001. .... = Path Segment Type: Logical Segment (1)" size="1" pos="152" show="1" value="1" unmaskedvalue="2c"/>
          <field name="cip.logical_segment.type" showname="...0 11.. = Logical Segment Type: Connection Point (3)" size="1" pos="152" show="3" value="3" unmaskedvalue="2c"/>
          <field name="cip.logical_segment.format" showname=".... ..00 = Logical Segment Format: 8-bit Logical Segment (0)" size="1" pos="152" show="0" value="0" unmaskedvalue="2c"/>
          <field name="cip.connpoint" showname="Connection Point: 0x01" size="1" pos="153" show="0x01" value="01"/>
        </field>
      </field>
    </field>
  </proto>
</packet>


<packet>
  <proto name="geninfo" pos="0" showname="General information" size="158">
    <field name="num" pos="0" show="2" showname="Number" value="2" size="158"/>
    <field name="len" pos="0" show="158" showname="Frame Length" value="9e" size="158"/>
    <field name="caplen" pos="0" show="158" showname="Captured Length" value="9e" size="158"/>
    <field name="timestamp" pos="0" show="Dec  3, 2003 23:34:33.327464000 CST" showname="Captured Time" value="1070465673.327464000" size="158"/>
  </proto>
  <proto name="frame" showname="Frame 2: 158 bytes on wire (1264 bits), 158 bytes captured (1264 bits)" size="158" pos="0">
    <field name="frame.encap_type" showname="Encapsulation type: Ethernet (1)" size="0" pos="0" show="1"/>
    <field name="frame.time" showname="Arrival Time: Dec  3, 2003 23:34:33.327464000 CST" size="0" pos="0" show="Dec  3, 2003 23:34:33.327464000 CST"/>
    <field name="frame.time_utc" showname="UTC Arrival Time: Dec  3, 2003 15:34:33.327464000 UTC" size="0" pos="0" show="Dec  3, 2003 15:34:33.327464000 UTC"/>
    <field name="frame.time_epoch" showname="Epoch Arrival Time: 1070465673.327464000" size="0" pos="0" show="1070465673.327464000"/>
    <field name="frame.offset_shift" showname="Time shift for this packet: 0.000000000 seconds" size="0" pos="0" show="0.000000000"/>
    <field name="frame.time_delta" showname="Time delta from previous captured frame: 2.601991000 seconds" size="0" pos="0" show="2.601991000"/>
    <field name="frame.time_delta_displayed" showname="Time delta from previous displayed frame: 2.601991000 seconds" size="0" pos="0" show="2.601991000"/>
    <field name="frame.time_relative" showname="Time since reference or first frame: 2.601991000 seconds" size="0" pos="0" show="2.601991000"/>
    <field name="frame.number" showname="Frame Number: 2" size="0" pos="0" show="2"/>
    <field name="frame.len" showname="Frame Length: 158 bytes (1264 bits)" size="0" pos="0" show="158"/>
    <field name="frame.cap_len" showname="Capture Length: 158 bytes (1264 bits)" size="0" pos="0" show="158"/>
    <field name="frame.marked" showname="Frame is marked: False" size="0" pos="0" show="False"/>
    <field name="frame.ignored" showname="Frame is ignored: False" size="0" pos="0" show="False"/>
    <field name="frame.protocols" showname="Protocols in frame: eth:ethertype:ip:tcp:enip:cip:cipcm" size="0" pos="0" show="eth:ethertype:ip:tcp:enip:cip:cipcm"/>
  </proto>
  <proto name="eth" showname="Ethernet II, Src: RockwellAuto_05:68:b8 (00:00:bc:05:68:b8), Dst: RockwellAuto_08:67:49 (00:00:bc:08:67:49)" size="14" pos="0">
    <field name="eth.dst" showname="Destination: RockwellAuto_08:67:49 (00:00:bc:08:67:49)" size="6" pos="0" show="00:00:bc:08:67:49" value="0000bc086749">
      <field name="eth.dst_resolved" showname="Destination (resolved): RockwellAuto_08:67:49" hide="yes" size="6" pos="0" show="RockwellAuto_08:67:49" value="0000bc086749"/>
      <field name="eth.dst.oui" showname="Destination OUI: 00:00:bc (Rockwell Automation)" hide="yes" size="3" pos="0" show="188" value="0000bc"/>
      <field name="eth.dst.oui_resolved" showname="Destination OUI (resolved): Rockwell Automation" hide="yes" size="6" pos="0" show="Rockwell Automation" value="0000bc086749"/>
      <field name="eth.dst.lg" showname=".... ..0. .... .... .... .... = LG bit: Globally unique address (factory default)" size="3" pos="0" show="False" value="0" unmaskedvalue="0000bc"/>
      <field name="eth.dst.ig" showname=".... ...0 .... .... .... .... = IG bit: Individual address (unicast)" size="3" pos="0" show="False" value="0" unmaskedvalue="0000bc"/>
      <field name="eth.addr" showname="Address: RockwellAuto_08:67:49 (00:00:bc:08:67:49)" hide="yes" size="6" pos="0" show="00:00:bc:08:67:49" value="0000bc086749"/>
      <field name="eth.addr_resolved" showname="Address (resolved): RockwellAuto_08:67:49" hide="yes" size="6" pos="0" show="RockwellAuto_08:67:49" value="0000bc086749"/>
      <field name="eth.addr.oui" showname="Address OUI: 00:00:bc (Rockwell Automation)" hide="yes" size="3" pos="0" show="188" value="0000bc"/>
      <field name="eth.addr.oui_resolved" showname="Address OUI (resolved): Rockwell Automation" hide="yes" size="6" pos="0" show="Rockwell Automation" value="0000bc086749"/>
      <field name="eth.lg" showname=".... ..0. .... .... .... .... = LG bit: Globally unique address (factory default)" hide="yes" size="3" pos="0" show="False" value="0" unmaskedvalue="0000bc"/>
      <field name="eth.ig" showname=".... ...0 .... .... .... .... = IG bit: Individual address (unicast)" hide="yes" size="3" pos="0" show="False" value="0" unmaskedvalue="0000bc"/>
    </field>
    <field name="eth.src" showname="Source: RockwellAuto_05:68:b8 (00:00:bc:05:68:b8)" size="6" pos="6" show="00:00:bc:05:68:b8" value="0000bc0568b8">
      <field name="eth.src_resolved" showname="Source (resolved): RockwellAuto_05:68:b8" hide="yes" size="6" pos="6" show="RockwellAuto_05:68:b8" value="0000bc0568b8"/>
      <field name="eth.src.oui" showname="Source OUI: 00:00:bc (Rockwell Automation)" hide="yes" size="3" pos="6" show="188" value="0000bc"/>
      <field name="eth.src.oui_resolved" showname="Source OUI (resolved): Rockwell Automation" hide="yes" size="6" pos="6" show="Rockwell Automation" value="0000bc0568b8"/>
      <field name="eth.src.lg" showname=".... ..0. .... .... .... .... = LG bit: Globally unique address (factory default)" size="3" pos="6" show="False" value="0" unmaskedvalue="0000bc"/>
      <field name="eth.src.ig" showname=".... ...0 .... .... .... .... = IG bit: Individual address (unicast)" size="3" pos="6" show="False" value="0" unmaskedvalue="0000bc"/>
      <field name="eth.addr" showname="Address: RockwellAuto_05:68:b8 (00:00:bc:05:68:b8)" hide="yes" size="6" pos="6" show="00:00:bc:05:68:b8" value="0000bc0568b8"/>
      <field name="eth.addr_resolved" showname="Address (resolved): RockwellAuto_05:68:b8" hide="yes" size="6" pos="6" show="RockwellAuto_05:68:b8" value="0000bc0568b8"/>
      <field name="eth.addr.oui" showname="Address OUI: 00:00:bc (Rockwell Automation)" hide="yes" size="3" pos="6" show="188" value="0000bc"/>
      <field name="eth.addr.oui_resolved" showname="Address OUI (resolved): Rockwell Automation" hide="yes" size="6" pos="6" show="Rockwell Automation" value="0000bc0568b8"/>
      <field name="eth.lg" showname=".... ..0. .... .... .... .... = LG bit: Globally unique address (factory default)" hide="yes" size="3" pos="6" show="False" value="0" unmaskedvalue="0000bc"/>
      <field name="eth.ig" showname=".... ...0 .... .... .... .... = IG bit: Individual address (unicast)" hide="yes" size="3" pos="6" show="False" value="0" unmaskedvalue="0000bc"/>
