<?xml version="1.0" encoding="utf-8"?>
<?xml-stylesheet type="text/xsl" href="pdml2html.xsl"?>
<!-- You can find pdml2html.xsl in /usr/share/doc/wireshark or at https://gitlab.com/wireshark/wireshark/-/tree/master/resources/share/doc/wireshark/pdml2html.xsl. -->
<pdml version="0" creator="wireshark/4.4.7" time="Sat Jul 19 23:46:02 2025" capture_file="./pcaps/modbus.pcap">
<packet>
  <proto name="geninfo" pos="0" showname="General information" size="66">
    <field name="num" pos="0" show="1" showname="Number" value="1" size="66"/>
    <field name="len" pos="0" show="66" showname="Frame Length" value="42" size="66"/>
    <field name="caplen" pos="0" show="66" showname="Captured Length" value="42" size="66"/>
    <field name="timestamp" pos="0" show="Nov 12, 2012 19:03:00.264400000 CST" showname="Captured Time" value="1352718180.264400000" size="66"/>
  </proto>
  <proto name="frame" showname="Frame 1: 66 bytes on wire (528 bits), 66 bytes captured (528 bits)" size="66" pos="0">
    <field name="frame.encap_type" showname="Encapsulation type: Ethernet (1)" size="0" pos="0" show="1"/>
    <field name="frame.time" showname="Arrival Time: Nov 12, 2012 19:03:00.264400000 CST" size="0" pos="0" show="Nov 12, 2012 19:03:00.264400000 CST"/>
    <field name="frame.time_utc" showname="UTC Arrival Time: Nov 12, 2012 11:03:00.264400000 UTC" size="0" pos="0" show="Nov 12, 2012 11:03:00.264400000 UTC"/>
    <field name="frame.time_epoch" showname="Epoch Arrival Time: 1352718180.264400000" size="0" pos="0" show="1352718180.264400000"/>
    <field name="frame.offset_shift" showname="Time shift for this packet: 0.000000000 seconds" size="0" pos="0" show="0.000000000"/>
    <field name="frame.time_delta" showname="Time delta from previous captured frame: 0.000000000 seconds" size="0" pos="0" show="0.000000000"/>
    <field name="frame.time_delta_displayed" showname="Time delta from previous displayed frame: 0.000000000 seconds" size="0" pos="0" show="0.000000000"/>
    <field name="frame.time_relative" showname="Time since reference or first frame: 0.000000000 seconds" size="0" pos="0" show="0.000000000"/>
    <field name="frame.number" showname="Frame Number: 1" size="0" pos="0" show="1"/>
    <field name="frame.len" showname="Frame Length: 66 bytes (528 bits)" size="0" pos="0" show="66"/>
    <field name="frame.cap_len" showname="Capture Length: 66 bytes (528 bits)" size="0" pos="0" show="66"/>
    <field name="frame.marked" showname="Frame is marked: False" size="0" pos="0" show="False"/>
    <field name="frame.ignored" showname="Frame is ignored: False" size="0" pos="0" show="False"/>
    <field name="frame.protocols" showname="Protocols in frame: eth:ethertype:ip:tcp:mbtcp:modbus" size="0" pos="0" show="eth:ethertype:ip:tcp:mbtcp:modbus"/>
  </proto>
  <proto name="eth" showname="Ethernet II, Src: HewlettPacka_e0:02:5e (78:e7:d1:e0:02:5e), Dst: SchneiderEle_02:58:b7 (00:04:17:02:58:b7)" size="14" pos="0">
    <field name="eth.dst" showname="Destination: SchneiderEle_02:58:b7 (00:04:17:02:58:b7)" size="6" pos="0" show="00:04:17:02:58:b7" value="0004170258b7">
      <field name="eth.dst_resolved" showname="Destination (resolved): SchneiderEle_02:58:b7" hide="yes" size="6" pos="0" show="SchneiderEle_02:58:b7" value="0004170258b7"/>
      <field name="eth.dst.oui" showname="Destination OUI: 00:04:17 (Schneider Electric)" hide="yes" size="3" pos="0" show="1047" value="000417"/>
      <field name="eth.dst.oui_resolved" showname="Destination OUI (resolved): Schneider Electric" hide="yes" size="6" pos="0" show="Schneider Electric" value="0004170258b7"/>
      <field name="eth.dst.lg" showname=".... ..0. .... .... .... .... = LG bit: Globally unique address (factory default)" size="3" pos="0" show="False" value="0" unmaskedvalue="000417"/>
      <field name="eth.dst.ig" showname=".... ...0 .... .... .... .... = IG bit: Individual address (unicast)" size="3" pos="0" show="False" value="0" unmaskedvalue="000417"/>
      <field name="eth.addr" showname="Address: SchneiderEle_02:58:b7 (00:04:17:02:58:b7)" hide="yes" size="6" pos="0" show="00:04:17:02:58:b7" value="0004170258b7"/>
      <field name="eth.addr_resolved" showname="Address (resolved): SchneiderEle_02:58:b7" hide="yes" size="6" pos="0" show="SchneiderEle_02:58:b7" value="0004170258b7"/>
      <field name="eth.addr.oui" showname="Address OUI: 00:04:17 (Schneider Electric)" hide="yes" size="3" pos="0" show="1047" value="000417"/>
      <field name="eth.addr.oui_resolved" showname="Address OUI (resolved): Schneider Electric" hide="yes" size="6" pos="0" show="Schneider Electric" value="0004170258b7"/>
      <field name="eth.lg" showname=".... ..0. .... .... .... .... = LG bit: Globally unique address (factory default)" hide="yes" size="3" pos="0" show="False" value="0" unmaskedvalue="000417"/>
      <field name="eth.ig" showname=".... ...0 .... .... .... .... = IG bit: Individual address (unicast)" hide="yes" size="3" pos="0" show="False" value="0" unmaskedvalue="000417"/>
    </field>
    <field name="eth.src" showname="Source: HewlettPacka_e0:02:5e (78:e7:d1:e0:02:5e)" size="6" pos="6" show="78:e7:d1:e0:02:5e" value="78e7d1e0025e">
      <field name="eth.src_resolved" showname="Source (resolved): HewlettPacka_e0:02:5e" hide="yes" size="6" pos="6" show="HewlettPacka_e0:02:5e" value="78e7d1e0025e"/>
      <field name="eth.src.oui" showname="Source OUI: 78:e7:d1 (Hewlett Packard)" hide="yes" size="3" pos="6" show="7923665" value="78e7d1"/>
      <field name="eth.src.oui_resolved" showname="Source OUI (resolved): Hewlett Packard" hide="yes" size="6" pos="6" show="Hewlett Packard" value="78e7d1e0025e"/>
      <field name="eth.src.lg" showname=".... ..0. .... .... .... .... = LG bit: Globally unique address (factory default)" size="3" pos="6" show="False" value="0" unmaskedvalue="78e7d1"/>
      <field name="eth.src.ig" showname=".... ...0 .... .... .... .... = IG bit: Individual address (unicast)" size="3" pos="6" show="False" value="0" unmaskedvalue="78e7d1"/>
      <field name="eth.addr" showname="Address: HewlettPacka_e0:02:5e (78:e7:d1:e0:02:5e)" hide="yes" size="6" pos="6" show="78:e7:d1:e0:02:5e" value="78e7d1e0025e"/>
      <field name="eth.addr_resolved" showname="Address (resolved): HewlettPacka_e0:02:5e" hide="yes" size="6" pos="6" show="HewlettPacka_e0:02:5e" value="78e7d1e0025e"/>
      <field name="eth.addr.oui" showname="Address OUI: 78:e7:d1 (Hewlett Packard)" hide="yes" size="3" pos="6" show="7923665" value="78e7d1"/>
      <field name="eth.addr.oui_resolved" showname="Address OUI (resolved): Hewlett Packard" hide="yes" size="6" pos="6" show="Hewlett Packard" value="78e7d1e0025e"/>
      <field name="eth.lg" showname=".... ..0. .... .... .... .... = LG bit: Globally unique address (factory default)" hide="yes" size="3" pos="6" show="False" value="0" unmaskedvalue="78e7d1"/>
      <field name="eth.ig" showname=".... ...0 .... .... .... .... = IG bit: Individual address (unicast)" hide="yes" size="3" pos="6" show="False" value="0" unmaskedvalue="78e7d1"/>
    </field>
    <field name="eth.type" showname="Type: IPv4 (0x0800)" size="2" pos="12" show="0x0800" value="0800"/>
    <field name="eth.stream" showname="Stream index: 0" size="0" pos="0" show="0"/>
  </proto>
  <proto name="ip" showname="Internet Protocol Version 4, Src: 141.81.0.10, Dst: 141.81.0.86" size="20" pos="14">
    <field name="ip.version" showname="0100 .... = Version: 4" size="1" pos="14" show="4" value="45"/>
    <field name="ip.hdr_len" showname=".... 0101 = Header Length: 20 bytes (5)" size="1" pos="14" show="20" value="45"/>
    <field name="ip.dsfield" showname="Differentiated Services Field: 0x00 (DSCP: CS0, ECN: Not-ECT)" size="1" pos="15" show="0x00" value="00">
      <field name="ip.dsfield.dscp" showname="0000 00.. = Differentiated Services Codepoint: Default (0)" size="1" pos="15" show="0" value="0" unmaskedvalue="00"/>
      <field name="ip.dsfield.ecn" showname=".... ..00 = Explicit Congestion Notification: Not ECN-Capable Transport (0)" size="1" pos="15" show="0" value="0" unmaskedvalue="00"/>
    </field>
    <field name="ip.len" showname="Total Length: 52" size="2" pos="16" show="52" value="0034"/>
    <field name="ip.id" showname="Identification: 0x7027 (28711)" size="2" pos="18" show="0x7027" value="7027"/>
    <field name="ip.flags" showname="010. .... = Flags: 0x2, Don&#x27;t fragment" size="1" pos="20" show="0x02" value="2" unmaskedvalue="40">
      <field name="ip.flags.rb" showname="0... .... = Reserved bit: Not set" size="1" pos="20" show="False" value="0" unmaskedvalue="40"/>
      <field name="ip.flags.df" showname=".1.. .... = Don&#x27;t fragment: Set" size="1" pos="20" show="True" value="1" unmaskedvalue="40"/>
      <field name="ip.flags.mf" showname="..0. .... = More fragments: Not set" size="1" pos="20" show="False" value="0" unmaskedvalue="40"/>
    </field>
    <field name="ip.frag_offset" showname="...0 0000 0000 0000 = Fragment Offset: 0" size="2" pos="20" show="0" value="0" unmaskedvalue="4000"/>
    <field name="ip.ttl" showname="Time to Live: 128" size="1" pos="22" show="128" value="80"/>
    <field name="ip.proto" showname="Protocol: TCP (6)" size="1" pos="23" show="6" value="06"/>
    <field name="ip.checksum" showname="Header Checksum: 0x0000 [validation disabled]" size="2" pos="24" show="0x0000" value="0000"/>
    <field name="ip.checksum.status" showname="Header checksum status: Unverified" size="0" pos="24" show="2"/>
    <field name="ip.src" showname="Source Address: 141.81.0.10" size="4" pos="26" show="141.81.0.10" value="8d51000a"/>
    <field name="ip.addr" showname="Source or Destination Address: 141.81.0.10" hide="yes" size="4" pos="26" show="141.81.0.10" value="8d51000a"/>
    <field name="ip.src_host" showname="Source Host: 141.81.0.10" hide="yes" size="4" pos="26" show="141.81.0.10" value="8d51000a"/>
    <field name="ip.host" showname="Source or Destination Host: 141.81.0.10" hide="yes" size="4" pos="26" show="141.81.0.10" value="8d51000a"/>
    <field name="ip.dst" showname="Destination Address: 141.81.0.86" size="4" pos="30" show="141.81.0.86" value="8d510056"/>
    <field name="ip.addr" showname="Source or Destination Address: 141.81.0.86" hide="yes" size="4" pos="30" show="141.81.0.86" value="8d510056"/>
    <field name="ip.dst_host" showname="Destination Host: 141.81.0.86" hide="yes" size="4" pos="30" show="141.81.0.86" value="8d510056"/>
    <field name="ip.host" showname="Source or Destination Host: 141.81.0.86" hide="yes" size="4" pos="30" show="141.81.0.86" value="8d510056"/>
    <field name="ip.stream" showname="Stream index: 0" size="0" pos="34" show="0"/>
  </proto>
  <proto name="tcp" showname="Transmission Control Protocol, Src Port: 57184, Dst Port: 502, Seq: 1, Ack: 1, Len: 12" size="20" pos="34">
    <field name="tcp.srcport" showname="Source Port: 57184" size="2" pos="34" show="57184" value="df60"/>
    <field name="tcp.dstport" showname="Destination Port: 502" size="2" pos="36" show="502" value="01f6"/>
    <field name="tcp.port" showname="Source or Destination Port: 57184" hide="yes" size="2" pos="34" show="57184" value="df60"/>
    <field name="tcp.port" showname="Source or Destination Port: 502" hide="yes" size="2" pos="36" show="502" value="01f6"/>
    <field name="tcp.stream" showname="Stream index: 0" size="0" pos="34" show="0"/>
    <field name="tcp.stream.pnum" showname="Stream Packet Number: 1" size="0" pos="34" show="1"/>
    <field name="tcp.completeness" showname="Conversation completeness: Incomplete (0)" size="0" pos="34" show="0">
      <field name="tcp.completeness.rst" showname="..0. .... = RST: Absent" size="0" pos="0" show="False"/>
      <field name="tcp.completeness.fin" showname="...0 .... = FIN: Absent" size="0" pos="0" show="False"/>
      <field name="tcp.completeness.data" showname=".... 0... = Data: Absent" size="0" pos="0" show="False"/>
      <field name="tcp.completeness.ack" showname=".... .0.. = ACK: Absent" size="0" pos="0" show="False"/>
      <field name="tcp.completeness.syn-ack" showname=".... ..0. = SYN-ACK: Absent" size="0" pos="0" show="False"/>
      <field name="tcp.completeness.syn" showname=".... ...0 = SYN: Absent" size="0" pos="0" show="False"/>
      <field name="tcp.completeness.str" showname="Completeness Flags: [ Null ]" size="0" pos="34" show="[ Null ]"/>
    </field>
    <field name="tcp.len" showname="TCP Segment Len: 12" size="0" pos="34" show="12"/>
    <field name="tcp.seq" showname="Sequence Number: 1    (relative sequence number)" size="4" pos="38" show="1" value="54dc4366"/>
    <field name="tcp.seq_raw" showname="Sequence Number (raw): 1423721318" size="4" pos="38" show="1423721318" value="54dc4366"/>
    <field name="tcp.nxtseq" showname="Next Sequence Number: 13    (relative sequence number)" size="0" pos="34" show="13"/>
    <field name="tcp.ack" showname="Acknowledgment Number: 1    (relative ack number)" size="4" pos="42" show="1" value="8054d326"/>
    <field name="tcp.ack_raw" showname="Acknowledgment number (raw): 2153042726" size="4" pos="42" show="2153042726" value="8054d326"/>
    <field name="tcp.hdr_len" showname="0101 .... = Header Length: 20 bytes (5)" size="1" pos="46" show="20" value="50"/>
    <field name="tcp.flags" showname="Flags: 0x018 (PSH, ACK)" size="2" pos="46" show="0x0018" value="18" unmaskedvalue="5018">
      <field name="tcp.flags.res" showname="000. .... .... = Reserved: Not set" size="1" pos="46" show="False" value="0" unmaskedvalue="50"/>
      <field name="tcp.flags.ae" showname="...0 .... .... = Accurate ECN: Not set" size="1" pos="46" show="False" value="0" unmaskedvalue="50"/>
      <field name="tcp.flags.cwr" showname=".... 0... .... = Congestion Window Reduced: Not set" size="1" pos="47" show="False" value="0" unmaskedvalue="18"/>
      <field name="tcp.flags.ece" showname=".... .0.. .... = ECN-Echo: Not set" size="1" pos="47" show="False" value="0" unmaskedvalue="18"/>
      <field name="tcp.flags.urg" showname=".... ..0. .... = Urgent: Not set" size="1" pos="47" show="False" value="0" unmaskedvalue="18"/>
      <field name="tcp.flags.ack" showname=".... ...1 .... = Acknowledgment: Set" size="1" pos="47" show="True" value="1" unmaskedvalue="18"/>
      <field name="tcp.flags.push" showname=".... .... 1... = Push: Set" size="1" pos="47" show="True" value="1" unmaskedvalue="18"/>
      <field name="tcp.flags.reset" showname=".... .... .0.. = Reset: Not set" size="1" pos="47" show="False" value="0" unmaskedvalue="18"/>
      <field name="tcp.flags.syn" showname=".... .... ..0. = Syn: Not set" size="1" pos="47" show="False" value="0" unmaskedvalue="18"/>
      <field name="tcp.flags.fin" showname=".... .... ...0 = Fin: Not set" size="1" pos="47" show="False" value="0" unmaskedvalue="18"/>
      <field name="tcp.flags.str" showname="TCP Flags: ·······AP···" size="2" pos="46" show="·······AP···" value="5018"/>
    </field>
    <field name="tcp.window_size_value" showname="Window: 63857" size="2" pos="48" show="63857" value="f971"/>
    <field name="tcp.window_size" showname="Calculated window size: 63857" size="2" pos="48" show="63857" value="f971"/>
    <field name="tcp.window_size_scalefactor" showname="Window size scaling factor: -1 (unknown)" size="2" pos="48" show="-1" value="f971"/>
    <field name="tcp.checksum" showname="Checksum: 0x1b29 [unverified]" size="2" pos="50" show="0x1b29" value="1b29"/>
    <field name="tcp.checksum.status" showname="Checksum Status: Unverified" size="0" pos="50" show="2"/>
    <field name="tcp.urgent_pointer" showname="Urgent Pointer: 0" size="2" pos="52" show="0" value="0000"/>
    <field name="" show="Timestamps" size="0" pos="34">
      <field name="tcp.time_relative" showname="Time since first frame in this TCP stream: 0.000000000 seconds" size="0" pos="34" show="0.000000000"/>
      <field name="tcp.time_delta" showname="Time since previous frame in this TCP stream: 0.000000000 seconds" size="0" pos="34" show="0.000000000"/>
    </field>
    <field name="tcp.analysis" showname="SEQ/ACK analysis" size="0" pos="34" show="" value="">
      <field name="tcp.analysis.bytes_in_flight" showname="Bytes in flight: 12" size="0" pos="34" show="12"/>
      <field name="tcp.analysis.push_bytes_sent" showname="Bytes sent since last PSH flag: 12" size="0" pos="34" show="12"/>
    </field>
    <field name="tcp.payload" showname="TCP payload (12 bytes)" size="12" pos="54" show="00:00:00:00:00:06:ff:04:08:d2:00:02" value="000000000006ff0408d20002"/>
    <field name="tcp.pdu.size" showname="PDU Size: 12" size="12" pos="54" show="12" value="000000000006ff0408d20002"/>
  </proto>
  <proto name="mbtcp" showname="Modbus/TCP" size="12" pos="54">
    <field name="mbtcp.trans_id" showname="Transaction Identifier: 0" size="2" pos="54" show="0" value="0000"/>
    <field name="mbtcp.prot_id" showname="Protocol Identifier: 0" size="2" pos="56" show="0" value="0000"/>
    <field name="mbtcp.len" showname="Length: 6" size="2" pos="58" show="6" value="0006"/>
    <field name="mbtcp.unit_id" showname="Unit Identifier: 255" size="1" pos="60" show="255" value="ff"/>
  </proto>
  <proto name="modbus" showname="Modbus" size="5" pos="61">
    <field name="modbus.func_code" showname=".000 0100 = Function Code: Read Input Registers (4)" size="1" pos="61" show="4" value="4" unmaskedvalue="04"/>
    <field name="modbus.reference_num" showname="Reference Number: 2258" size="2" pos="62" show="2258" value="08d2"/>
    <field name="modbus.word_cnt" showname="Word Count: 2" size="2" pos="64" show="2" value="0002"/>
  </proto>
</packet>


<packet>
  <proto name="geninfo" pos="0" showname="General information" size="66">
    <field name="num" pos="0" show="2" showname="Number" value="2" size="66"/>
    <field name="len" pos="0" show="66" showname="Frame Length" value="42" size="66"/>
    <field name="caplen" pos="0" show="66" showname="Captured Length" value="42" size="66"/>
    <field name="timestamp" pos="0" show="Nov 12, 2012 19:03:00.265397000 CST" showname="Captured Time" value="1352718180.265397000" size="66"/>
  </proto>
  <proto name="frame" showname="Frame 2: 66 bytes on wire (528 bits), 66 bytes captured (528 bits)" size="66" pos="0">
    <field name="frame.encap_type" showname="Encapsulation type: Ethernet (1)" size="0" pos="0" show="1"/>
    <field name="frame.time" showname="Arrival Time: Nov 12, 2012 19:03:00.265397000 CST" size="0" pos="0" show="Nov 12, 2012 19:03:00.265397000 CST"/>
    <field name="frame.time_utc" showname="UTC Arrival Time: Nov 12, 2012 11:03:00.265397000 UTC" size="0" pos="0" show="Nov 12, 2012 11:03:00.265397000 UTC"/>
    <field name="frame.time_epoch" showname="Epoch Arrival Time: 1352718180.265397000" size="0" pos="0" show="1352718180.265397000"/>
    <field name="frame.offset_shift" showname="Time shift for this packet: 0.000000000 seconds" size="0" pos="0" show="0.000000000"/>
    <field name="frame.time_delta" showname="Time delta from previous captured frame: 0.000997000 seconds" size="0" pos="0" show="0.000997000"/>
    <field name="frame.time_delta_displayed" showname="Time delta from previous displayed frame: 0.000997000 seconds" size="0" pos="0" show="0.000997000"/>
    <field name="frame.time_relative" showname="Time since reference or first frame: 0.000997000 seconds" size="0" pos="0" show="0.000997000"/>
    <field name="frame.number" showname="Frame Number: 2" size="0" pos="0" show="2"/>
    <field name="frame.len" showname="Frame Length: 66 bytes (528 bits)" size="0" pos="0" show="66"/>
    <field name="frame.cap_len" showname="Capture Length: 66 bytes (528 bits)" size="0" pos="0" show="66"/>
    <field name="frame.marked" showname="Frame is marked: False" size="0" pos="0" show="False"/>
    <field name="frame.ignored" showname="Frame is ignored: False" size="0" pos="0" show="False"/>
    <field name="frame.protocols" showname="Protocols in frame: eth:ethertype:ip:tcp:mbtcp:modbus" size="0" pos="0" show="eth:ethertype:ip:tcp:mbtcp:modbus"/>
  </proto>
  <proto name="eth" showname="Ethernet II, Src: HewlettPacka_e0:02:5e (78:e7:d1:e0:02:5e), Dst: SchneiderEle_02:58:b7 (00:04:17:02:58:b7)" size="14" pos="0">
    <field name="eth.dst" showname="Destination: SchneiderEle_02:58:b7 (00:04:17:02:58:b7)" size="6" pos="0" show="00:04:17:02:58:b7" value="0004170258b7">
      <field name="eth.dst_resolved" showname="Destination (resolved): SchneiderEle_02:58:b7" hide="yes" size="6" pos="0" show="SchneiderEle_02:58:b7" value="0004170258b7"/>
      <field name="eth.dst.oui" showname="Destination OUI: 00:04:17 (Schneider Electric)" hide="yes" size="3" pos="0" show="1047" value="000417"/>
      <field name="eth.dst.oui_resolved" showname="Destination OUI (resolved): Schneider Electric" hide="yes" size="6" pos="0" show="Schneider Electric" value="0004170258b7"/>
      <field name="eth.dst.lg" showname=".... ..0. .... .... .... .... = LG bit: Globally unique address (factory default)" size="3" pos="0" show="False" value="0" unmaskedvalue="000417"/>
      <field name="eth.dst.ig" showname=".... ...0 .... .... .... .... = IG bit: Individual address (unicast)" size="3" pos="0" show="False" value="0" unmaskedvalue="000417"/>
      <field name="eth.addr" showname="Address: SchneiderEle_02:58:b7 (00:04:17:02:58:b7)" hide="yes" size="6" pos="0" show="00:04:17:02:58:b7" value="0004170258b7"/>
      <field name="eth.addr_resolved" showname="Address (resolved): SchneiderEle_02:58:b7" hide="yes" size="6" pos="0" show="SchneiderEle_02:58:b7" value="0004170258b7"/>
      <field name="eth.addr.oui" showname="Address OUI: 00:04:17 (Schneider Electric)" hide="yes" size="3" pos="0" show="1047" value="000417"/>
      <field name="eth.addr.oui_resolved" showname="Address OUI (resolved): Schneider Electric" hide="yes" size="6" pos="0" show="Schneider Electric" value="0004170258b7"/>
      <field name="eth.lg" showname=".... ..0. .... .... .... .... = LG bit: Globally unique address (factory default)" hide="yes" size="3" pos="0" show="False" value="0" unmaskedvalue="000417"/>
      <field name="eth.ig" showname=".... ...0 .... .... .... .... = IG bit: Individual address (unicast)" hide="yes" size="3" pos="0" show="False" value="0" unmaskedvalue="000417"/>
    </field>
    <field name="eth.src" showname="Source: HewlettPacka_e0:02:5e (78:e7:d1:e0:02:5e)" size="6" pos="6" show="78:e7:d1:e0:02:5e" value="78e7d1e0025e">
      <field name="eth.src_resolved" showname="Source (resolved): HewlettPacka_e0:02:5e" hide="yes" size="6" pos="6" show="HewlettPacka_e0:02:5e" value="78e7d1e0025e"/>
      <field name="eth.src.oui" showname="Source OUI: 78:e7:d1 (Hewlett Packard)" hide="yes" size="3" pos="6" show="7923665" value="78e7d1"/>
      <field name="eth.src.oui_resolved" showname="Source OUI (resolved): Hewlett Packard" hide="yes" size="6" pos="6" show="Hewlett Packard" value="78e7d1e0025e"/>
      <field name="eth.src.lg" showname=".... ..0. .... .... .... .... = LG bit: Globally unique address (factory default)" size="3" pos="6" show="False" value="0" unmaskedvalue="78e7d1"/>
      <field name="eth.src.ig" showname=".... ...0 .... .... .... .... = IG bit: Individual address (unicast)" size="3" pos="6" show="False" value="0" unmaskedvalue="78e7d1"/>
      <field name="eth.addr" showname="Address: HewlettPacka_e0:02:5e (78:e7:d1:e0:02:5e)" hide="yes" size="6" pos="6" show="78:e7:d1:e0:02:5e" value="78e7d1e0025e"/>
      <field name="eth.addr_resolved" showname="Address (resolved): HewlettPacka_e0:02:5e" hide="yes" size="6" pos="6" show="HewlettPacka_e0:02:5e" value="78e7d1e0025e"/>
      <field name="eth.addr.oui" showname="Address OUI: 78:e7:d1 (Hewlett Packard)" hide="yes" size="3" pos="6" show="7923665" value="78e7d1"/>
      <field name="eth.addr.oui_resolved" showname="Address OUI (resolved): Hewlett Packard" hide="yes" size="6" pos="6" show="Hewlett Packard" value="78e7d1e0025e"/>
      <field name="eth.lg" showname=".... ..0. .... .... .... .... = LG bit: Globally unique address (factory default)" hide="yes" size="3" pos="6" show="False" value="0" unmaskedvalue="78e7d1"/>
      <field name="eth.ig" showname=".... ...0 .... .... .... .... = IG bit: Individual address (unicast)" hide="yes" size="3" pos="6" show="False" value="0" unmaskedvalue="78e7d1"/>
    </field>
    <field name="eth.type" showname="Type: IPv4 (0x0800)" size="2" pos="12" show="0x0800" value="0800"/>
    <field name="eth.stream" showname="Stream index: 0" size="0" pos="0" show="0"/>
  </proto>
  <proto name="ip" showname="Internet Protocol Version 4, Src: 141.81.0.10, Dst: 141.81.0.86" size="20" pos="14">
    <field name="ip.version" showname="0100 .... = Version: 4" size="1" pos="14" show="4" value="45"/>
    <field name="ip.hdr_len" showname=".... 0101 = Header Length: 20 bytes (5)" size="1" pos="14" show="20" value="45"/>
    <field name="ip.dsfield" showname="Differentiated Services Field: 0x00 (DSCP: CS0, ECN: Not-ECT)" size="1" pos="15" show="0x00" value="00">
      <field name="ip.dsfield.dscp" showname="0000 00.. = Differentiated Services Codepoint: Default (0)" size="1" pos="15" show="0" value="0" unmaskedvalue="00"/>
      <field name="ip.dsfield.ecn" showname=".... ..00 = Explicit Congestion Notification: Not ECN-Capable Transport (0)" size="1" pos="15" show="0" value="0" unmaskedvalue="00"/>
    </field>
    <field name="ip.len" showname="Total Length: 52" size="2" pos="16" show="52" value="0034"/>
    <field name="ip.id" showname="Identification: 0x7029 (28713)" size="2" pos="18" show="0x7029" value="7029"/>
    <field name="ip.flags" showname="010. .... = Flags: 0x2, Don&#x27;t fragment" size="1" pos="20" show="0x02" value="2" unmaskedvalue="40">
      <field name="ip.flags.rb" showname="0... .... = Reserved bit: Not set" size="1" pos="20" show="False" value="0" unmaskedvalue="40"/>
      <field name="ip.flags.df" showname=".1.. .... = Don&#x27;t fragment: Set" size="1" pos="20" show="True" value="1" unmaskedvalue="40"/>
      <field name="ip.flags.mf" showname="..0. .... = More fragments: Not set" size="1" pos="20" show="False" value="0" unmaskedvalue="40"/>
    </field>
    <field name="ip.frag_offset" showname="...0 0000 0000 0000 = Fragment Offset: 0" size="2" pos="20" show="0" value="0" unmaskedvalue="4000"/>
    <field name="ip.ttl" showname="Time to Live: 128" size="1" pos="22" show="128" value="80"/>
    <field name="ip.proto" showname="Protocol: TCP (6)" size="1" pos="23" show="6" value="06"/>
    <field name="ip.checksum" showname="Header Checksum: 0x0000 [validation disabled]" size="2" pos="24" show="0x0000" value="0000"/>
    <field name="ip.checksum.status" showname="Header checksum status: Unverified" size="0" pos="24" show="2"/>
    <field name="ip.src" showname="Source Address: 141.81.0.10" size="4" pos="26" show="141.81.0.10" value="8d51000a"/>
    <field name="ip.addr" showname="Source or Destination Address: 141.81.0.10" hide="yes" size="4" pos="26" show="141.81.0.10" value="8d51000a"/>
    <field name="ip.src_host" showname="Source Host: 141.81.0.10" hide="yes" size="4" pos="26" show="141.81.0.10" value="8d51000a"/>
    <field name="ip.host" showname="Source or Destination Host: 141.81.0.10" hide="yes" size="4" pos="26" show="141.81.0.10" value="8d51000a"/>
    <field name="ip.dst" showname="Destination Address: 141.81.0.86" size="4" pos="30" show="141.81.0.86" value="8d510056"/>
    <field name="ip.addr" showname="Source or Destination Address: 141.81.0.86" hide="yes" size="4" pos="30" show="141.81.0.86" value="8d510056"/>
    <field name="ip.dst_host" showname="Destination Host: 141.81.0.86" hide="yes" size="4" pos="30" show="141.81.0.86" value="8d510056"/>
    <field name="ip.host" showname="Source or Destination Host: 141.81.0.86" hide="yes" size="4" pos="30" show="141.81.0.86" value="8d510056"/>
    <field name="ip.stream" showname="Stream index: 0" size="0" pos="34" show="0"/>
  </proto>
  <proto name="tcp" showname="Transmission Control Protocol, Src Port: 57184, Dst Port: 502, Seq: 13, Ack: 274, Len: 12" size="20" pos="34">
    <field name="tcp.srcport" showname="Source Port: 57184" size="2" pos="34" show="57184" value="df60"/>
    <field name="tcp.dstport" showname="Destination Port: 502" size="2" pos="36" show="502" value="01f6"/>
    <field name="tcp.port" showname="Source or Destination Port: 57184" hide="yes" size="2" pos="34" show="57184" value="df60"/>
    <field name="tcp.port" showname="Source or Destination Port: 502" hide="yes" size="2" pos="36" show="502" value="01f6"/>
    <field name="tcp.stream" showname="Stream index: 0" size="0" pos="34" show="0"/>
    <field name="tcp.stream.pnum" showname="Stream Packet Number: 2" size="0" pos="34" show="2"/>
    <field name="tcp.completeness" showname="Conversation completeness: Incomplete (8)" size="0" pos="34" show="8">
      <field name="tcp.completeness.rst" showname="..0. .... = RST: Absent" size="0" pos="0" show="False"/>
      <field name="tcp.completeness.fin" showname="...0 .... = FIN: Absent" size="0" pos="0" show="False"/>
      <field name="tcp.completeness.data" showname=".... 1... = Data: Present" size="0" pos="0" show="True"/>
      <field name="tcp.completeness.ack" showname=".... .0.. = ACK: Absent" size="0" pos="0" show="False"/>
      <field name="tcp.completeness.syn-ack" showname=".... ..0. = SYN-ACK: Absent" size="0" pos="0" show="False"/>
      <field name="tcp.completeness.syn" showname=".... ...0 = SYN: Absent" size="0" pos="0" show="False"/>
      <field name="tcp.completeness.str" showname="Completeness Flags: ··D···" size="0" pos="34" show="··D···"/>
    </field>
    <field name="tcp.len" showname="TCP Segment Len: 12" size="0" pos="34" show="12"/>
    <field name="tcp.seq" showname="Sequence Number: 13    (relative sequence number)" size="4" pos="38" show="13" value="54dc4372"/>
    <field name="tcp.seq_raw" showname="Sequence Number (raw): 1423721330" size="4" pos="38" show="1423721330" value="54dc4372"/>
    <field name="tcp.nxtseq" showname="Next Sequence Number: 25    (relative sequence number)" size="0" pos="34" show="25"/>
    <field name="tcp.ack" showname="Acknowledgment Number: 274    (relative ack number)" size="4" pos="42" show="274" value="8054d437"/>
    <field name="tcp.ack_raw" showname="Acknowledgment number (raw): 2153042999" size="4" pos="42" show="2153042999" value="8054d437"/>
    <field name="tcp.hdr_len" showname="0101 .... = Header Length: 20 bytes (5)" size="1" pos="46" show="20" value="50"/>
    <field name="tcp.flags" showname="Flags: 0x018 (PSH, ACK)" size="2" pos="46" show="0x0018" value="18" unmaskedvalue="5018">
      <field name="tcp.flags.res" showname="000. .... .... = Reserved: Not set" size="1" pos="46" show="False" value="0" unmaskedvalue="50"/>
      <field name="tcp.flags.ae" showname="...0 .... .... = Accurate ECN: Not set" size="1" pos="46" show="False" value="0" unmaskedvalue="50"/>
      <field name="tcp.flags.cwr" showname=".... 0... .... = Congestion Window Reduced: Not set" size="1" pos="47" show="False" value="0" unmaskedvalue="18"/>
      <field name="tcp.flags.ece" showname=".... .0.. .... = ECN-Echo: Not set" size="1" pos="47" show="False" value="0" unmaskedvalue="18"/>
      <field name="tcp.flags.urg" showname=".... ..0. .... = Urgent: Not set" size="1" pos="47" show="False" value="0" unmaskedvalue="18"/>
      <field name="tcp.flags.ack" showname=".... ...1 .... = Acknowledgment: Set" size="1" pos="47" show="True" value="1" unmaskedvalue="18"/>
      <field name="tcp.flags.push" showname=".... .... 1... = Push: Set" size="1" pos="47" show="True" value="1" unmaskedvalue="18"/>
      <field name="tcp.flags.reset" showname=".... .... .0.. = Reset: Not set" size="1" pos="47" show="False" value="0" unmaskedvalue="18"/>
      <field name="tcp.flags.syn" showname=".... .... ..0. = Syn: Not set" size="1" pos="47" show="False" value="0" unmaskedvalue="18"/>
      <field name="tcp.flags.fin" showname=".... .... ...0 = Fin: Not set" size="1" pos="47" show="False" value="0" unmaskedvalue="18"/>
      <field name="tcp.flags.str" showname="TCP Flags: ·······AP···" size="2" pos="46" show="·······AP···" value="5018"/>
    </field>
    <field name="tcp.window_size_value" showname="Window: 63584" size="2" pos="48" show="63584" value="f860"/>
    <field name="tcp.window_size" showname="Calculated window size: 63584" size="2" pos="48" show="63584" value="f860"/>
    <field name="tcp.window_size_scalefactor" showname="Window size scaling factor: -1 (unknown)" size="2" pos="48" show="-1" value="f860"/>
    <field name="tcp.checksum" showname="Checksum: 0x1b29 [unverified]" size="2" pos="50" show="0x1b29" value="1b29"/>
    <field name="tcp.checksum.status" showname="Checksum Status: Unverified" size="0" pos="50" show="2"/>
    <field name="tcp.urgent_pointer" showname="Urgent Pointer: 0" size="2" pos="52" show="0" value="0000"/>
    <field name="" show="Timestamps" size="0" pos="34">
      <field name="tcp.time_relative" showname="Time since first frame in this TCP stream: 0.000997000 seconds" size="0" pos="34" show="0.000997000"/>
      <field name="tcp.time_delta" showname="Time since previous frame in this TCP stream: 0.000997000 seconds" size="0" pos="34" show="0.000997000"/>
    </field>
    <field name="tcp.analysis" showname="SEQ/ACK analysis" size="0" pos="34" show="" value="">
      <field name="tcp.analysis.bytes_in_flight" showname="Bytes in flight: 24" size="0" pos="34" show="24"/>
      <field name="tcp.analysis.push_bytes_sent" showname="Bytes sent since last PSH flag: 12" size="0" pos="34" show="12"/>
    </field>
    <field name="tcp.payload" showname="TCP payload (12 bytes)" size="12" pos="54" show="00:01:00:00:00:06:ff:02:00:63:00:1e" value="000100000006ff020063001e"/>
    <field name="tcp.pdu.size" showname="PDU Size: 12" size="12" pos="54" show="12" value="000100000006ff020063001e"/>
  </proto>
  <proto name="mbtcp" showname="Modbus/TCP" size="12" pos="54">
    <field name="mbtcp.trans_id" showname="Transaction Identifier: 1" size="2" pos="54" show="1" value="0001"/>
    <field name="mbtcp.prot_id" showname="Protocol Identifier: 0" size="2" pos="56" show="0" value="0000"/>
    <field name="mbtcp.len" showname="Length: 6" size="2" pos="58" show="6" value="0006"/>
    <field name="mbtcp.unit_id" showname="Unit Identifier: 255" size="1" pos="60" show="255" value="ff"/>
  </proto>
  <proto name="modbus" showname="Modbus" size="5" pos="61">
    <field name="modbus.func_code" showname=".000 0010 = Function Code: Read Discrete Inputs (2)" size="1" pos="61" show="2" value="2" unmaskedvalue="02"/>
    <field name="modbus.reference_num" showname="Reference Number: 99" size="2" pos="62" show="99" value="0063"/>
    <field name="modbus.bit_cnt" showname="Bit Count: 30" size="2" pos="64" show="30" value="001e"/>
  </proto>
</packet>


<packet>
  <proto name="geninfo" pos="0" showname="General information" size="66">
    <field name="num" pos="0" show="3" showname="Number" value="3" size="66"/>
    <field name="len" pos="0" show="66" showname="Frame Length" value="42" size="66"/>
    <field name="caplen" pos="0" show="66" showname="Captured Length" value="42" size="66"/>
    <field name="timestamp" pos="0" show="Nov 12, 2012 19:03:00.337028000 CST" showname="Captured Time" value="1352718180.337028000" size="66"/>
  </proto>
  <proto name="frame" showname="Frame 3: 66 bytes on wire (528 bits), 66 bytes captured (528 bits)" size="66" pos="0">
    <field name="frame.encap_type" showname="Encapsulation type: Ethernet (1)" size="0" pos="0" show="1"/>
    <field name="frame.time" showname="Arrival Time: Nov 12, 2012 19:03:00.337028000 CST" size="0" pos="0" show="Nov 12, 2012 19:03:00.337028000 CST"/>
    <field name="frame.time_utc" showname="UTC Arrival Time: Nov 12, 2012 11:03:00.337028000 UTC" size="0" pos="0" show="Nov 12, 2012 11:03:00.337028000 UTC"/>
    <field name="frame.time_epoch" showname="Epoch Arrival Time: 1352718180.337028000" size="0" pos="0" show="1352718180.337028000"/>
    <field name="frame.offset_shift" showname="Time shift for this packet: 0.000000000 seconds" size="0" pos="0" show="0.000000000"/>
    <field name="frame.time_delta" showname="Time delta from previous captured frame: 0.071631000 seconds" size="0" pos="0" show="0.071631000"/>
    <field name="frame.time_delta_displayed" showname="Time delta from previous displayed frame: 0.071631000 seconds" size="0" pos="0" show="0.071631000"/>
    <field name="frame.time_relative" showname="Time since reference or first frame: 0.072628000 seconds" size="0" pos="0" show="0.072628000"/>
    <field name="frame.number" showname="Frame Number: 3" size="0" pos="0" show="3"/>
    <field name="frame.len" showname="Frame Length: 66 bytes (528 bits)" size="0" pos="0" show="66"/>
    <field name="frame.cap_len" showname="Capture Length: 66 bytes (528 bits)" size="0" pos="0" show="66"/>
    <field name="frame.marked" showname="Frame is marked: False" size="0" pos="0" show="False"/>
    <field name="frame.ignored" showname="Frame is ignored: False" size="0" pos="0" show="False"/>
    <field name="frame.protocols" showname="Protocols in frame: eth:ethertype:ip:tcp:mbtcp:modbus" size="0" pos="0" show="eth:ethertype:ip:tcp:mbtcp:modbus"/>
  </proto>
  <proto name="eth" showname="Ethernet II, Src: HewlettPacka_e0:02:5e (78:e7:d1:e0:02:5e), Dst: TaiwanCommat_08:5b:00 (00:03:1d:08:5b:00)" size="14" pos="0">
    <field name="eth.dst" showname="Destination: TaiwanCommat_08:5b:00 (00:03:1d:08:5b:00)" size="6" pos="0" show="00:03:1d:08:5b:00" value="00031d085b00">
      <field name="eth.dst_resolved" showname="Destination (resolved): TaiwanCommat_08:5b:00" hide="yes" size="6" pos="0" show="TaiwanCommat_08:5b:00" value="00031d085b00"/>
      <field name="eth.dst.oui" showname="Destination OUI: 00:03:1d (Taiwan Commate Computer, Inc.)" hide="yes" size="3" pos="0" show="797" value="00031d"/>
      <field name="eth.dst.oui_resolved" showname="Destination OUI (resolved): Taiwan Commate Computer, Inc." hide="yes" size="6" pos="0" show="Taiwan Commate Computer, Inc." value="00031d085b00"/>
      <field name="eth.dst.lg" showname=".... ..0. .... .... .... .... = LG bit: Globally unique address (factory default)" size="3" pos="0" show="False" value="0" unmaskedvalue="00031d"/>
      <field name="eth.dst.ig" showname=".... ...0 .... .... .... .... = IG bit: Individual address (unicast)" size="3" pos="0" show="False" value="0" unmaskedvalue="00031d"/>
      <field name="eth.addr" showname="Address: TaiwanCommat_08:5b:00 (00:03:1d:08:5b:00)" hide="yes" size="6" pos="0" show="00:03:1d:08:5b:00" value="00031d085b00"/>
      <field name="eth.addr_resolved" showname="Address (resolved): TaiwanCommat_08:5b:00" hide="yes" size="6" pos="0" show="TaiwanCommat_08:5b:00" value="00031d085b00"/>
      <field name="eth.addr.oui" showname="Address OUI: 00:03:1d (Taiwan Commate Computer, Inc.)" hide="yes" size="3" pos="0" show="797" value="00031d"/>
      <field name="eth.addr.oui_resolved" showname="Address OUI (resolved): Taiwan Commate Computer, Inc." hide="yes" size="6" pos="0" show="Taiwan Commate Computer, Inc." value="00031d085b00"/>
      <field name="eth.lg" showname=".... ..0. .... .... .... .... = LG bit: Globally unique address (factory default)" hide="yes" size="3" pos="0" show="False" value="0" unmaskedvalue="00031d"/>
      <field name="eth.ig" showname=".... ...0 .... .... .... .... = IG bit: Individual address (unicast)" hide="yes" size="3" pos="0" show="False" value="0" unmaskedvalue="00031d"/>
    </field>
    <field name="eth.src" showname="Source: HewlettPacka_e0:02:5e (78:e7:d1:e0:02:5e)" size="6" pos="6" show="78:e7:d1:e0:02:5e" value="78e7d1e0025e">
      <field name="eth.src_resolved" showname="Source (resolved): HewlettPacka_e0:02:5e" hide="yes" size="6" pos="6" show="HewlettPacka_e0:02:5e" value="78e7d1e0025e"/>
      <field name="eth.src.oui" showname="Source OUI: 78:e7:d1 (Hewlett Packard)" hide="yes" size="3" pos="6" show="7923665" value="78e7d1"/>
